{
  "schemaVersion": "r4_public_core_local_postgres_integration_campaign_evidence.v1",
  "status": "LOCAL_POSTGRES_INTEGRATION_CAMPAIGN_IMPLEMENTATION_EVIDENCE_GREEN_STATUS_FREEZE_REQUIRED_GATE_C_NOT_REQUESTED",
  "generatedAt": "2026-08-15T08:04:01Z",
  "authority": {
    "constructionPacketSha256": "sha256:1bfcb75483b359d335812b573b42e3eac0ce669c734295248f2447daf5262d50",
    "constructionOwnerReviewSha256": "sha256:3ad46ae641bdc1573341ff1221f27589c480b7bad9f4fe41e2a5641758d3296f",
    "packetHead": "1f5b9476d891d348161d4a43d918b53873a809e2",
    "packetTree": "3f42dc6707d2438bd3ad92e17de938210027c80e",
    "ownerReviewHead": "c15753d299530dfccd027f0ec2a93db77d74a1e9",
    "ownerReviewTree": "228a2ec1b9f771e7bbb747420645a45011865aa3",
    "ownerApproval": "APPROVED_OUTCOME_ENVELOPE_ALL_NINE_CHOICES",
    "constructionEnvelope": "CONSUMED_BY_KI_LI_MI_ONLY",
    "replacementDiagnostic": "NOT_REQUESTED",
    "cleanup": "NOT_REQUESTED",
    "physicalExecution": "NOT_REQUESTED",
    "production": "NOT_REQUESTED",
    "gateC": "NOT_REQUESTED"
  },
  "lineage": {
    "baseline": {
      "head": "1e46cb589e7cdebb1566d28bbdd6e13cd4066946",
      "tree": "a7bd77c67bb5b002cbcf6c56495e1b24fba09262",
      "parentHead": "852744e7e1210c5faf1968b257c4221c1693ebf4",
      "parentTree": "e01520c9d3f756919e75eb118f7cd66ba92e8a4a"
    },
    "packet": {
      "head": "1f5b9476d891d348161d4a43d918b53873a809e2",
      "tree": "3f42dc6707d2438bd3ad92e17de938210027c80e",
      "parentHead": "1e46cb589e7cdebb1566d28bbdd6e13cd4066946",
      "parentTree": "a7bd77c67bb5b002cbcf6c56495e1b24fba09262",
      "exactDelta": "1_PATH_1A",
      "artifactSha256": "sha256:1bfcb75483b359d335812b573b42e3eac0ce669c734295248f2447daf5262d50"
    },
    "ownerReview": {
      "head": "c15753d299530dfccd027f0ec2a93db77d74a1e9",
      "tree": "228a2ec1b9f771e7bbb747420645a45011865aa3",
      "parentHead": "1f5b9476d891d348161d4a43d918b53873a809e2",
      "parentTree": "3f42dc6707d2438bd3ad92e17de938210027c80e",
      "exactDelta": "1_PATH_1A",
      "artifactSha256": "sha256:3ad46ae641bdc1573341ff1221f27589c480b7bad9f4fe41e2a5641758d3296f"
    },
    "implementation": {
      "head": "76afe10ee53b81f316dbc48bd4e412771e2ae0c7",
      "tree": "49ab93f6c3ef5b57488d4dda244aad527a9dafd6",
      "parentHead": "c15753d299530dfccd027f0ec2a93db77d74a1e9",
      "parentTree": "228a2ec1b9f771e7bbb747420645a45011865aa3",
      "exactDelta": "2_PATHS_0A_2M_0D_0R",
      "artifactAggregateSha256": "sha256:5a8faefbb7e5014e16e786269c5fae36f56b9900e2a162e8a3633e698154eacc"
    }
  },
  "workset": {
    "implementationCommitCount": 1,
    "evidenceCommitCount": 1,
    "statusCommitCount": 1,
    "totalCommitCount": 3,
    "implementationPathCount": 2,
    "evidencePathCount": 3,
    "statusPathCount": 10,
    "totalPathCount": 15,
    "addedPathCount": 4,
    "modifiedPathCount": 11,
    "implementationPaths": [
      "scripts/r4-public-core-local-postgres.mjs",
      "test/r4/public-core-local-postgres.test.ts"
    ],
    "evidencePaths": [
      "docs/evidence/r4-public-core-local-postgres-integration-campaign.json",
      "schemas/r4/public-core/local-postgres-integration-campaign-artifact-index.json",
      "schemas/r4/public-core/local-postgres-integration-campaign-evidence.schema.json"
    ],
    "statusPaths": [
      "README.md",
      "docs/CONTROL.md",
      "docs/DECISIONS.md",
      "docs/NATIVE-HARNESS-ARCHITECTURE.md",
      "docs/PRODUCT.md",
      "docs/R4-PUBLIC-CORE-GATE-C-ACTIVATION-CARD.md",
      "docs/R4-PUBLIC-CORE-LOCAL-POSTGRES-INTEGRATION-CAMPAIGN-CONSTRUCTION-REPORT.md",
      "docs/README.md",
      "docs/ROADMAP.md",
      "docs/VALIDATION.md"
    ]
  },
  "constructionBoundary": {
    "campaignStateMachineConstructed": true,
    "campaignGrantV1Constructed": true,
    "campaignJournalV1Constructed": true,
    "campaignReceiptV1Constructed": true,
    "executionAuthorityV1ParserConstructed": true,
    "committedTopologyVerifierConstructed": true,
    "diagnosticClassifierConstructed": true,
    "exactOwnershipCleanupGuardConstructed": true,
    "absenceBeforePhysicalGuardConstructed": true,
    "durableWriteAheadEffectLedgerConstructed": true,
    "clockAndHostDriftGuardsConstructed": true,
    "oneUseAndNoRetryGuardsConstructed": true,
    "cleanupRecoveryCeilingConstructed": true,
    "replacementDiagnosticExecuted": false,
    "historicalCleanupExecuted": false,
    "disposableLocalPostgresRehearsalExecuted": false,
    "targetPostgresObserved": false,
    "targetCatalogObserved": false,
    "ownerApprovalReceiptCreated": false,
    "pendingCampaignGrantCreated": false,
    "pendingCampaignGrantConsumed": false,
    "dockerCliInvoked": false,
    "productionDriverPoolConfigured": false,
    "productionMigrationApplied": false,
    "runtimeApiRouteActive": false,
    "trafficReady": false,
    "gateCReady": false
  },
  "constructedCampaignContract": {
    "designOnly": true,
    "grantSchemaVersion": "r4.public-core-local-postgres-integration-campaign-grant.v1",
    "journalSchemaVersion": "r4.public-core-local-postgres-integration-campaign-journal-entry.v1",
    "receiptSchemaVersion": "r4.public-core-local-postgres-integration-campaign-receipt.v1",
    "executionAuthoritySchemaVersion": "r4.public-core-local-postgres-integration-campaign-authority.v1",
    "maximumGrantLifetimeHours": 24,
    "maximumCampaignConsumptions": 1,
    "maximumDiagnosticPhases": 1,
    "maximumHistoricalCleanupPhases": 1,
    "maximumPhysicalConstructionPhases": 1,
    "maximumPhysicalCleanupRecoveryPhases": 2,
    "maximumAnonymousImagePulls": 1,
    "diagnosticDockerCalls": {
      "version": 1,
      "image.inspect": 0,
      "image.pull": 0,
      "container.inspect": 2,
      "container.create": 0,
      "container.start": 0,
      "container.stop": 1,
      "container.rm": 1,
      "network.inspect": 2,
      "network.create": 0,
      "network.rm": 1,
      "volume.inspect": 2,
      "volume.create": 0,
      "volume.rm": 1
    },
    "physicalDockerCalls": {
      "version": 3,
      "image.inspect": 2,
      "image.pull": 1,
      "container.inspect": 8,
      "container.create": 1,
      "container.start": 2,
      "container.stop": 4,
      "container.rm": 3,
      "network.inspect": 7,
      "network.create": 1,
      "network.rm": 3,
      "volume.inspect": 7,
      "volume.create": 1,
      "volume.rm": 3
    },
    "maximumInitialReadinessAttempts": 60,
    "maximumRestartReadinessAttempts": 60,
    "maximumOperationalPoolConstructions": 4,
    "maximumTotalPoolConstructions": 124,
    "maximumTotalConnectionAttempts": 124,
    "maximumConcurrentPools": 1,
    "maximumConcurrentClients": 1,
    "maximumConcurrentTransactions": 1,
    "maximumCreatedDatabaseIdentities": 2,
    "maximumSchemaApplies": 3,
    "maximumVerifies": 3,
    "maximumRollbacks": 1,
    "maximumDomainActionInvocations": 23,
    "maximumDistinctDomainActions": 20,
    "maximumContainerRestarts": 1,
    "maximumAdminCreateDatabaseStatements": 1,
    "postgresServerVersionNum": 160010,
    "catalog": {
      "tables": 14,
      "columns": 207,
      "constraints": 172,
      "indexes": 44
    }
  },
  "historicalContract": {
    "labelKey": "forme.r4.public-core.local.grant",
    "labelValue": "b92ae04555cc3d69a16c06ae53b30976",
    "container": "forme-r4-public-core-local-b92ae04555cc3d69",
    "network": "forme-r4-public-core-local-net-b92ae04555cc3d69",
    "volume": "forme-r4-public-core-local-vol-b92ae04555cc3d69",
    "physicalConsumedGrantSha256": "sha256:a4f782b8da35b8a2afe7d881b87949326e50f81b0493e2e7ea3dfc70dfc5ba35",
    "physicalFinalEvidenceSha256": "sha256:b3de0db43bf85ead32019266c73d9e9c397f8c7c576f2e5284b8496e980f985c",
    "physicalJournalEntryCount": 34,
    "physicalJournalSha256": "sha256:2efe5233f94b9f57f17c08aaa792adb2c2353ee75f03ee326b16dcdcd4f10a25",
    "rescueConsumedGrantSha256": "sha256:fc0af89348695275b789c17578fc3c856e150a42f999ba1efdc6e05d62889654",
    "rescueFinalEvidenceSha256": "sha256:b138dcff20f1085cb8f237c505d6b2a8bb760926981cf4eef325a6e3b213a979",
    "rescueJournalEntryCount": 6,
    "rescueJournalSha256": "sha256:e4c8e688464ad9ec6ac897be68d537e558c31ab505e4151e0458767265f84491",
    "diagnosticCardSha256": "sha256:1cd345018dc6ddbf393df873bca01a54fcb75f8e608f9f63a48c9f61fd06319e",
    "diagnosticReviewSha256": "sha256:324af94569b0c54456e474230bc06b3e7f15573ee97ec4a46c5886d56969abed",
    "diagnosticPayloadSha256": "sha256:53188dac86131bf4910f06dc8dd64e7f1127d29cd55f21882960ab674a24262d",
    "allConsumedOrFailedAuthoritiesReusable": false
  },
  "validation": {
    "testLanes": [
      {
        "laneId": "integration_campaign_focused_deny_network",
        "command": "node --import ./scripts/deny-external-network.mjs --test --test-name-pattern='integration campaign|authorized effect engines' test/r4/public-core-local-postgres.test.ts",
        "denyNetwork": true,
        "total": 14,
        "passed": 14,
        "failed": 0,
        "status": "PASS"
      },
      {
        "laneId": "r4_offline_regression",
        "command": "npm run test:r4:offline",
        "denyNetwork": true,
        "total": 747,
        "passed": 747,
        "failed": 0,
        "status": "PASS"
      },
      {
        "laneId": "gate_b_core_successor_regression",
        "command": "npm run test:r4:gate-b-core",
        "denyNetwork": true,
        "total": 145,
        "passed": 145,
        "failed": 0,
        "status": "PASS"
      },
      {
        "laneId": "spine_regression",
        "command": "node --import ./scripts/deny-external-network.mjs --test test/*.test.ts",
        "denyNetwork": true,
        "total": 45,
        "passed": 45,
        "failed": 0,
        "status": "PASS"
      }
    ],
    "checkLanes": [
      {
        "laneId": "runner_node_check",
        "command": "node --check scripts/r4-public-core-local-postgres.mjs",
        "status": "PASS"
      },
      {
        "laneId": "typescript",